{
  "source": "reddit",
  "platform": "reddit",
  "post_type": "post",
  "subreddit": "r/diabetes",
  "post_id": "jkl012",
  "author_id": "u_t1dlife",
  "author_type": "unknown",
  "created_utc": "2024-07-25T11:45:00Z", 
  "lang": "en",
  "metrics": {
    "likes": 8,
    "comments": 15,
    "shares": 1
  },
  "title": "Low blood sugar episodes getting worse",
  "body": "I'm T1D for 15 years and lately my hypoglycemia episodes are more frequent. Sometimes I get shaky and sweaty especially in the mornings. My endo suggested checking my insulin dosing and maybe trying tirzepatide. Anyone else dealing with more frequent lows recently?",
  "url": "https://reddit.com/r/diabetes/comments/jkl012", 
  "normalized_text": "I'm T1D for 15 years and lately my hypoglycemia episodes are more frequent. Sometimes I get shaky and sweaty especially in the mornings. My endo suggested checking my insulin dosing and maybe trying tirzepatide. Anyone else dealing with more frequent lows recently?"
}